{"adopted_for_execution":false,"bindings":[{"sha256":"d46193a975a7d3afdb3c6a3b5c038157e6bd246458bc054c043adc80c45ac020","uri":"control/armindex/a1.2/execution-contract.live-preflight-packaging-repair.v8.json"},{"sha256":"aaa15d54d73d78fd6237f71d99f9068579b2bc4451a6af15417024e345e076a6","uri":"campaigns/armindex-multiretriever-v2/evidence/a1.2-live-preflight-packaging-repair.receipt.v8.json"},{"sha256":"28402c57d22400b343cdc94ef88aa285ce94eedf3cb44680c9679c6be9654acd","uri":"control/armindex/a1.2/owner-instance-continuation-policy.v1.json"},{"sha256":"8b8d29d08f4939cc96131e4265e0760dcb986c1aa1851cef3c8c7957f264ad3f","uri":"src/myis_research/armindex/a1_2_live_preflight_execution_v9.py"},{"sha256":"babf17f311f30ab119bbd2fee7655226f3dd928dd09ed01c29eecfa7b2835dbc","uri":"src/myis_research/armindex/a1_2_live_preflight_runtime_v9.py"},{"sha256":"af5c2fe6ef0853a4fb5fcebb0dce877ef521fd21ce595ad63b118603963766c4","uri":"scripts/a1_2_vast/remote-live-preflight-v9.sh"},{"sha256":"b3651b77c06c06dda54169e31fb880261cf9db0b553a3dcf004d592f09ebafce","uri":"scripts/a1_2_vast/Invoke-A12VastDirectBaseCoordinatorV9.ps1"},{"sha256":"c99dfc7bcb1289136df3ae992346a25a0b6e3ba66bb25689821b50f4246e9358","uri":"scripts/a1_2_vast/remote-bootstrap-direct-base-v9.sh"},{"sha256":"90a0d9eb61eafb4353d1907f72e183ea61e28ed8954cbe58187f936f8e56b476","uri":"docs/operations/A1_2_VAST_4X3090_OWNER_RUNBOOK_V9.md"},{"sha256":"945188d828eccda02dc841f53176b92e6ba74cc436c45f624ed2a10f193041a0","uri":"schemas/armindex/a1.2-live-preflight-execution-lifecycle.v9.json"}],"charged_usd":0,"claim_boundary":"synthetic execution-lifecycle repair only; no measured retrieval or scientific result","continuation_policy_sha256":"28402c57d22400b343cdc94ef88aa285ce94eedf3cb44680c9679c6be9654acd","contract_sha256":"84f3f44e6d9eecd6dff000f839f70a06710f66179ada00cb44ebc76038072783","evidence_class":"live_engineering_preflight_execution_lifecycle_repair","final_accesses":0,"implementation_validation_complete":true,"launch_allowed":false,"live_preflight_execution_pending":true,"measured_runs":0,"new_remote_root":"/opt/myis/a1.2-v9","receipt_id":"a1.2-live-preflight-execution-lifecycle-v9","receipt_sha256":"cc71a8cb6baceee86e639d20dfa94affcfdd38c61aa1b3088a651660ca2d224a","revision_id":"a1.2-live-preflight-execution-lifecycle-v9","schema_version":"myis.armindex-a1.2-live-preflight-execution-lifecycle.v9","scientific_authority":false,"selection_accesses":0,"status":"execution_lifecycle_repair_prepared_preflight_pending","v8_receipt_sha256":"7cc3adb3f454b9ab7911270cfef9cb17863f39292d644b18396bf285af98b6b5"}
